maturation_symbol,short_token,longterm_class,read_state,memory_maturation_quality,memory_segment_quality,memory_field_quality,memory_follow_class,current_class,current_weight,current_world_span,classification_note
dio_mature_0yx0oq2,0z748ck,langfristig_getragen,bruecke_gehalten,maturation_reorganisationsbruecke_gehalten,mehrwelt_segmentbruecke,feld_leicht_stabilisierend,lokaler_anschlussanker,lokaler_anschlussanker,12,5,Reorganisationsbruecke bleibt auch in weiterer Welt sichtbar.
dio_mature_0eigbm8,00dz86x,kurzfristige_oberflaeche,nicht_wiedergefunden,maturation_jung_gehalten,segment_nicht_gelesen,feld_unguelesen,schwacher_anschluss,-,0,0,Junge oder offene Spur bleibt nicht sichtbar.
dio_mature_0bf3x2q,00nzcuc,kurzfristige_oberflaeche,nicht_wiedergefunden,maturation_jung_gehalten,segment_nicht_gelesen,feld_unguelesen,schwacher_anschluss,-,0,0,Junge oder offene Spur bleibt nicht sichtbar.
dio_mature_109zkut,00yl137,abgeschwaecht_oder_verloren,nicht_wiedergefunden,maturation_reifung,kurze_mehrweltspur,feld_jung_instabiler_austritt,brueckenkern,-,0,0,Vorherige junge Reifung wird in Folgewelt nicht getragen.
dio_mature_1619pcd,0om13wf,weltabhaengig_getragen,reifung_abgeschwaecht,maturation_reifung,kurze_mehrweltspur,feld_rekoppelnd_schaerfend,brueckenkern,schwacher_anschluss,3,1,"Reifung bleibt sichtbar, verliert aber Zentralitaet."
dio_mature_0w1iqyf,1hdpu9s,langfristig_belastet_getragen,rolle_gehalten_bestaetigt,maturation_rolle_gehalten,lange_mehrweltphase,feld_belastete_kernnaehe,schwacher_anschluss,schwacher_anschluss,11,3,"Rolle bleibt sichtbar, traegt aber belastete Kernnaehe."
dio_mature_18eoltu,0db07p4,verschwunden_bestaetigt,verschwindung_bestaetigt,maturation_verschwindet,segment_nicht_gelesen,feld_unguelesen,-,-,0,0,Verschwinden wird erneut gelesen und ist selbst Information.
dio_mature_0nxg7f6,1ahj81f,verschwunden_bestaetigt,verschwindung_bestaetigt,maturation_verschwindet,segment_nicht_gelesen,feld_unguelesen,-,-,0,0,Verschwinden wird erneut gelesen und ist selbst Information.
