passive_only,read_by_mini_dio,influences_action,is_gate,is_motoric,is_entry_signal,is_direction_signal,network_state,nodes,observations_total,worlds_total,avg_neighbor_count,avg_rekopplung,avg_strain,top_roles,top_movement_quality,top_shift_quality,top_stability_quality,top_drift_quality,condition_reading
1,0,0,0,0,0,0,netz_offen_verbunden,37,1231,454,1.837838,-0.03861,0.046825,aufsteigende_verdichtung:32 | -:4 | brueckenkern:1,role_condensing:32 | -:4 | maturation_reifung:1,-:36 | shift_verlust_zu_randspur:1,gaining_weight:32 | -:4 | kurze_mehrweltspur:1,surface_role_movement:32 | -:4 | feld_jung_instabiler_austritt:1,Offene Verbindung zeigt Anschluss ohne klare Zentrums- oder Rekopplungsbindung.
1,0,0,0,0,0,0,netz_rekoppelnd_verbunden,32,510,274,1.6875,0.026703,-0.020958,aufsteigende_verdichtung:25 | -:4 | absteigende_entlastung:2 | schwacher_anschluss:1,role_condensing:25 | -:4 | role_releasing:2 | maturation_jung_gehalten:1,-:29 | shift_weltabhaengig_zu_rekopplung:1 | shift_oberflaeche_zu_offen:1 | shift_nicht_sichtbar:1,gaining_weight:25 | -:4 | losing_role_weight:2 | segment_nicht_gelesen:1,surface_role_movement:25 | -:4 | role_releasing_or_fading:2 | feld_unguelesen:1,"Rekopplung entsteht, wenn Feldanschluss und Entlastung gemeinsam staerker wirken als Strain."
1,0,0,0,0,0,0,netz_fragmentiert_belastet,28,4163,1402,3.392857,-0.058689,0.062391,rollendrift:12 | stabile_rolle:10 | kernnah_gehalten:6,role_drifting:12 | role_stable:10 | role_core_near_retained:6,-:28,stable_surface:10 | variable_but_carried:8 | stable_core:6 | gaining_weight:4,low_drift:16 | explicit_role_drift:12,"Fragmentierung wird belastet, wenn Strain und Aussen-/Brueckenriss trotz sichtbarer Kernnaehe hoch bleiben."
1,0,0,0,0,0,0,netz_driftend_getragen,22,1120,492,2.181818,0.02395,-0.014202,stabile_rolle:13 | rollendrift:7 | kernnah_gehalten:2,role_stable:13 | role_drifting:7 | role_core_near_retained:2,-:19 | shift_verschwinden_zu_zentrum:2 | shift_bruecke_zu_zentrum_getragen:1,stable_surface:13 | variable_but_carried:6 | stable_core:2 | gaining_weight:1,low_drift:15 | explicit_role_drift:7,"Drift bleibt getragen, wenn Rollenbewegung sichtbar ist, aber Rekopplung Strain nicht klar unterliegt."
1,0,0,0,0,0,0,netz_rekoppelnd_einzeln,16,32,32,0.0,0.0,0.0,absteigende_entlastung:16,role_releasing:16,-:16,losing_role_weight:16,role_releasing_or_fading:16,Einzelrekopplung zeigt Entlastung ohne tragendes Nachbarschaftsnetz.
1,0,0,0,0,0,0,netz_zentrum_mit_anschluss,8,7352,516,5.625,0.00183,0.005805,aufsteigende_verdichtung:4 | kernnah_gehalten:3 | absteigende_entlastung:1,role_condensing:4 | role_core_near_retained:3 | role_releasing:1,-:7 | shift_belastete_reifung_zu_zentrum:1,core_near_retained:7 | losing_role_weight:1,core_boundary_movement:7 | role_releasing_or_fading:1,"Zentrumsnaehe entsteht, wenn Kern-/Zentrumsqualitaet mit Anschlussnachbarschaft zusammen sichtbar wird."
